{
  "schema_version": "2.0",
  "generated_at": "2026-09-13T06:24:21.170377+00:00",
  "source_date": "2026-09-13",
  "universe_info": {
    "universe_type": "VN30_MIDCAP_LEADERS",
    "universe_size": 42
  },
  "market": {
    "regime": "STRONG_BULL",
    "regime_score": 80.0,
    "confidence": 0.85,
    "metrics": {
      "vnindex_value": 832.7,
      "vnindex_change_pct": 2.11,
      "vn30_change_pct": 1.96,
      "market_breadth_ratio": 0.98,
      "volatility": 0.2927,
      "volume_20d_ratio": 1.6
    }
  },
  "summary": {
    "total_scanned": 42,
    "buy_count": 10,
    "watch_count": 26,
    "hold_count": 5,
    "sell_count": 1,
    "avoid_count": 0
  },
  "recommendations": [
    {
      "symbol": "ACB",
      "company_name": "Ngân hàng TMCP Á Châu",
      "exchange": "HOSE",
      "sector": "Ngân hàng",
      "action": "BUY",
      "alpha_score": 90.0,
      "risk_adjusted_alpha": 65.6,
      "confidence": 0.9,
      "risk_level": "MEDIUM",
      "expected_return": {
        "expected_return_5d": null,
        "expected_return_10d": null,
        "expected_return_20d": null
      },
      "risk_metrics": {
        "var_t25": -0.0424,
        "es_t25": -0.0486,
        "volatility_60d": 0.2318,
        "max_drawdown": -0.2307,
        "liquidity_score": 4.8,
        "avg_value_20d": 0.02
      },
      "trade_plan": {
        "current_price": 23549.0,
        "entry_low": 23550.0,
        "entry_high": 24000.0,
        "stop_loss": 22500.0,
        "tp1": 25200.0,
        "tp2": 25200.0,
        "risk_reward": 1.57,
        "position_percent": 20.0
      },
      "reasons": [
        "Giá đóng cửa (23.549 VNĐ) nằm trên đường xu hướng MA20 (22.063 VNĐ).",
        "Giá đóng cửa nằm trên hỗ trợ trung hạn MA50 (20.943 VNĐ).",
        "MACD Histogram dương và đang tăng trưởng, củng cố đà tăng.",
        "Khối lượng bùng nổ 1.4x so với bình quân 20 phiên.",
        "Sức mạnh tương quan (RS) vượt trội so với VN-Index (+8.3%).",
        "Xuất hiện tín hiệu Phân Kỳ Dương trên khung 1W."
      ],
      "warnings": ["RSI (77.3) thuộc vùng quá mua (> 70)."],
      "invalidation": [
        "Giá đóng cửa vi phạm ngưỡng cắt lỗ 22.500 VNĐ.",
        "Giá gãy hỗ trợ trung hạn MA50 (20.943 VNĐ).",
        "Trạng thái thị trường chung suy giảm sang PANIC."
      ],
      "divergence": {
        "1H": "NONE",
        "1D": "NONE",
        "1W": "BULLISH",
        "1M": "NONE"
      }
    },
    {
      "symbol": "BCM",
      "company_name": "Tổng Công ty Đầu tư và Phát triển Công nghiệp",
      "exchange": "HOSE",
      "sector": "Bất động sản KCN",
      "action": "WATCH",
      "alpha_score": 60.0,
      "risk_adjusted_alpha": 53.0,
      "confidence": 0.65,
      "risk_level": "MEDIUM",
      "expected_return": {
        "expected_return_5d": null,
        "expected_return_10d": null,
        "expected_return_20d": null
      },
      "risk_metrics": {
        "var_t25": -0.0243,
        "es_t25": -0.0309,
        "volatility_60d": 0.1784,
        "max_drawdown": -0.1224,
        "liquidity_score": 88.1,
        "avg_value_20d": 0.13
      },
      "trade_plan": {
        "current_price": 86760.0,
        "entry_low": 86800.0,
        "entry_high": 88500.0,
        "stop_loss": 82400.0,
        "tp1": 92800.0,
        "tp2": 92800.0,
        "risk_reward": 1.39,
        "position_percent": 10.0
      },
      "reasons": [
        "Giá đóng cửa (86.760 VNĐ) nằm trên đường xu hướng MA20 (79.964 VNĐ).",
        "Giá đóng cửa nằm trên hỗ trợ trung hạn MA50 (75.355 VNĐ).",
        "Khối lượng bùng nổ 1.3x so với bình quân 20 phiên.",
        "Sức mạnh tương quan (RS) vượt trội so với VN-Index (+12.5%)."
      ],
      "warnings": [
        "RSI (90.8) rơi vào vùng quá mua nặng (> 78), rủi ro đảo chiều cao.",
        "Cảnh báo Phân Kỳ Âm trên khung 1D."
      ],
      "invalidation": [
        "Giá đóng cửa vi phạm ngưỡng cắt lỗ 82.400 VNĐ.",
        "Giá gãy hỗ trợ trung hạn MA50 (75.355 VNĐ).",
        "Trạng thái thị trường chung suy giảm sang PANIC."
      ],
      "divergence": {
        "1H": "NONE",
        "1D": "BEARISH",
        "1W": "NONE",
        "1M": "NONE"
      }
    },
    {
      "symbol": "BID",
      "company_name": "Ngân hàng TMCP Đầu tư và Phát triển Việt Nam",
      "exchange": "HOSE",
      "sector": "Ngân hàng",
      "action": "BUY",
      "alpha_score": 75.0,
      "risk_adjusted_alpha": 65.2,
      "confidence": 0.7,
      "risk_level": "MEDIUM",
      "expected_return": {
        "expected_return_5d": null,
        "expected_return_10d": null,
        "expected_return_20d": null
      },
      "risk_metrics": {
        "var_t25": -0.0317,
        "es_t25": -0.0363,
        "volatility_60d": 0.155,
        "max_drawdown": -0.15,
        "liquidity_score": 77.4,
        "avg_value_20d": 0.08
      },
      "trade_plan": {
        "current_price": 53815.0,
        "entry_low": 53800.0,
        "entry_high": 54900.0,
        "stop_loss": 51400.0,
        "tp1": 57600.0,
        "tp2": 57600.0,
        "risk_reward": 1.57,
        "position_percent": 20.0
      },
      "reasons": [
        "Giá đóng cửa (53.815 VNĐ) nằm trên đường xu hướng MA20 (51.068 VNĐ).",
        "Giá đóng cửa nằm trên hỗ trợ trung hạn MA50 (49.342 VNĐ).",
        "MACD Histogram dương và đang tăng trưởng, củng cố đà tăng.",
        "Khối lượng bùng nổ 1.4x so với bình quân 20 phiên."
      ],
      "warnings": ["RSI (81.0) rơi vào vùng quá mua nặng (> 78), rủi ro đảo chiều cao."],
      "invalidation": [
        "Giá đóng cửa vi phạm ngưỡng cắt lỗ 51.400 VNĐ.",
        "Giá gãy hỗ trợ trung hạn MA50 (49.342 VNĐ).",
        "Trạng thái thị trường chung suy giảm sang PANIC."
      ],
      "divergence": {
        "1H": "NONE",
        "1D": "NONE",
        "1W": "NONE",
        "1M": "NONE"
      }
    },
    {
      "symbol": "BVH",
      "company_name": "Tập đoàn Bảo Việt",
      "exchange": "HOSE",
      "sector": "Bảo hiểm",
      "action": "HOLD",
      "alpha_score": 50.0,
      "risk_adjusted_alpha": 42.6,
      "confidence": 0.65,
      "risk_level": "MEDIUM",
      "expected_return": {
        "expected_return_5d": null,
        "expected_return_10d": null,
        "expected_return_20d": null
      },
      "risk_metrics": {
        "var_t25": -0.0285,
        "es_t25": -0.0333,
        "volatility_60d": 0.1764,
        "max_drawdown": -0.165,
        "liquidity_score": 69.0,
        "avg_value_20d": 0.07
      },
      "trade_plan": {
        "current_price": 50321.0,
        "entry_low": null,
        "entry_high": null,
        "stop_loss": null,
        "tp1": null,
        "tp2": null,
        "risk_reward": null,
        "position_percent": 0.0
      },
      "reasons": [
        "Giá đóng cửa (50.321 VNĐ) nằm trên đường xu hướng MA20 (47.985 VNĐ).",
        "Giá đóng cửa nằm trên hỗ trợ trung hạn MA50 (46.734 VNĐ).",
        "MACD Histogram dương và đang tăng trưởng, củng cố đà tăng."
      ],
      "warnings": [
        "RSI (77.3) thuộc vùng quá mua (> 70).",
        "Cảnh báo Phân Kỳ Âm trên khung 1D.",
        "Cảnh báo Phân Kỳ Âm trên khung 1W."
      ],
      "invalidation": [
        "Giá vượt lên trên MA20 kèm thanh khoản bùng nổ vượt 1.5x bình quân 20 phiên.",
        "Tín hiệu phân kỳ dương hình thành trên khung 1D."
      ],
      "divergence": {
        "1H": "NONE",
        "1D": "BEARISH",
        "1W": "BEARISH",
        "1M": "NONE"
      }
    },
    {
      "symbol": "CTG",
      "company_name": "Ngân hàng TMCP Công Thương Việt Nam",
      "exchange": "HOSE",
      "sector": "Ngân hàng",
      "action": "SELL",
      "alpha_score": 15.0,
      "risk_adjusted_alpha": 11.8,
      "confidence": 0.6,
      "risk_level": "MEDIUM",
      "expected_return": {
        "expected_return_5d": null,
        "expected_return_10d": null,
        "expected_return_20d": null
      },
      "risk_metrics": {
        "var_t25": -0.0382,
        "es_t25": -0.0424,
        "volatility_60d": 0.1837,
        "max_drawdown": -0.2255,
        "liquidity_score": 40.5,
        "avg_value_20d": 0.04
      },
      "trade_plan": {
        "current_price": 33447.0,
        "entry_low": null,
        "entry_high": null,
        "stop_loss": null,
        "tp1": null,
        "tp2": null,
        "risk_reward": null,
        "position_percent": 0.0
      },
      "reasons": [],
      "warnings": [
        "Giá đóng cửa (33.447 VNĐ) nằm dưới đường xu hướng MA20 (34.604 VNĐ).",
        "MACD Histogram âm, báo hiệu áp lực điều chỉnh.",
        "RSI (27.7) quá bán nặng (< 35).",
        "Sức mạnh tương quan (RS) yếu hơn VN-Index (-13.2%)."
      ],
      "invalidation": [
        "Giá vượt lên trên MA20 kèm thanh khoản bùng nổ vượt 1.5x bình quân 20 phiên.",
        "Tín hiệu phân kỳ dương hình thành trên khung 1D."
      ],
      "divergence": {
        "1H": "NONE",
        "1D": "NONE",
        "1W": "NONE",
        "1M": "NONE"
      }
    },
    {
      "symbol": "FPT",
      "company_name": "Công ty Cổ phần FPT",
      "exchange": "HOSE",
      "sector": "Công nghệ",
      "action": "WATCH",
      "alpha_score": 60.0,
      "risk_adjusted_alpha": 50.8,
      "confidence": 0.75,
      "risk_level": "MEDIUM",
      "expected_return": {
        "expected_return_5d": null,
        "expected_return_10d": null,
        "expected_return_20d": null
      },
      "risk_metrics": {
        "var_t25": -0.0386,
        "es_t25": -0.0478,
        "volatility_60d": 0.2097,
        "max_drawdown": -0.2447,
        "liquidity_score": 95.2,
        "avg_value_20d": 0.15
      },
      "trade_plan": {
        "current_price": 133310.0,
        "entry_low": 133300.0,
        "entry_high": 136000.0,
        "stop_loss": 126400.0,
        "tp1": 142600.0,
        "tp2": 142600.0,
        "risk_reward": 1.34,
        "position_percent": 10.0
      },
      "reasons": [
        "Giá đóng cửa (133.310 VNĐ) nằm trên đường xu hướng MA20 (125.801 VNĐ).",
        "Giá đóng cửa nằm trên hỗ trợ trung hạn MA50 (125.200 VNĐ).",